speaker,speech,document
Lex Fridman,"So maybe just just to jump back what's what's the history of the game in general? Is it true that Henry Kissinger love the game? And JFK and all those that I've heard like a bunch of different people that or is that just one of those things that the cool kids say they do, but they don't actually play?",Noam Brown - AI vs Humans in Poker and Games of Strategic Negotiation.txt
Noam Brown,"So the game was created in the 50s. And from what I understand it was JFK days it was played in like the JFK White House Henry Kissinger's favorite game. I don't know if it's true, but that's definitely what I've heard. It's",Noam Brown - AI vs Humans in Poker and Games of Strategic Negotiation.txt
Lex Fridman,"interesting that they went with World War One, when it was created after World War Two.",Noam Brown - AI vs Humans in Poker and Games of Strategic Negotiation.txt
Noam Brown,"So the story that I've heard for the creation of the game is it was created by somebody that had looked at the history of the 20th century, and they saw World War One as a failure of diplomacy. So sure, you know, they saw the fact that this war broke out as like the diplomats of all these countries like really failed to prevent a war and he wanted to create a game that would basically teach people about diplomacy. And it's really fascinating that like in his ideal version of the game of diplomacy, nobody actually wins the game. Because the whole point is that if somebody is about to win, then the other players should be able to work together to stop that person from winning. And so the ideal version of the game is just one where nobody actually wins. And, you know, it's kind of nice, like, wholesome take home message then that, you know, war war is ultimately futile. And",Noam Brown - AI vs Humans in Poker and Games of Strategic Negotiation.txt
Lex Fridman,"and that optimal that futile, optimal could be achieved through great diplomacy. Yep. So is there some asymmetry in in terms of which is more powerful Russia versus Germany versus France, and so on?",Noam Brown - AI vs Humans in Poker and Games of Strategic Negotiation.txt
Noam Brown,"So I think the general consensus is that France is the strongest power in the game. But the beautiful thing about diplomacy is that it's self balancing. Right. So the fact that France has an inherent advantage from the beginning, means that the other players are less likely to work with it.",Noam Brown - AI vs Humans in Poker and Games of Strategic Negotiation.txt
Lex Fridman,"So that Russia has four units, verse four, have something that the others have three of something",Noam Brown - AI vs Humans in Poker and Games of Strategic Negotiation.txt
Noam Brown,"that's true. Yeah. So Russia starts off with four units, while they all the other players start with three. But Russia is also in a much more vulnerable position, because they have to like, they have a lot more neighbors as well.",Noam Brown - AI vs Humans in Poker and Games of Strategic Negotiation.txt
Lex Fridman,"Larger territory more. Yeah, right. More border to defend. Okay. What else is, what else is important to know about the rules? So they're there? How many rounds are there? Like, is this iterative game is there is is a finite just keep going indefinitely.",Noam Brown - AI vs Humans in Poker and Games of Strategic Negotiation.txt
Noam Brown,"Usually, the game lasts, I would say about 15, or 20. Turns. There's, in theory, no limit, it could last longer. But at some point, I mean, if you're playing a house game with friends, at some point is get tired. And you all agree like, Okay, we're going to end the game here and call it a draw. If you're playing online, there's usually like set limits on when the game will actually end.",Noam Brown - AI vs Humans in Poker and Games of Strategic Negotiation.txt
Lex Fridman,"And what's the end? What's the termination condition like this, this one country have to conquer everything else.",Noam Brown - AI vs Humans in Poker and Games of Strategic Negotiation.txt
Noam Brown,"So if somebody is able to actually gain control of a majority of the map, then then they've won the game. And that is a solo victory, as it's called. Now, that pretty rarely happens, especially with strong players, because like I said, the game is designed to incentivize the other players to put a stop to that and all work together to stop the superpower. Usually, what ends up happening is that, you know, all the players agree to withdraw. And then the score, the win is divided among the remaining players. There's a lot of different scoring systems, the one that we used in our research, basically, gives a score relative to how much control you have of the map. So the more that you control, the higher your score.",Noam Brown - AI vs Humans in Poker and Games of Strategic Negotiation.txt
Lex Fridman,What's the history of using this game as a benchmark for AI research? To? Do people use it?,Noam Brown - AI vs Humans in Poker and Games of Strategic Negotiation.txt
Noam Brown,"Yeah, so people have been working on AI for diplomacy since about the 80s. There was some really exciting research back then. But the approach that was taken was very different from what we see today, the research in the 80s was a very rule based approach, kind of kind of a heuristic approach is very in line with the kind of research that was being done in the 80s. You know, basically trying to encode human knowledge into the strategy of the AI. Sure. And, you know, it's understandable, I mean, the game is so incredibly different. And so, so much more complicated than the kinds of games that people working on like chess, and go, and poker that it was honestly even hard to, like, start getting making any progress in diplomacy. Can you just",Noam Brown - AI vs Humans in Poker and Games of Strategic Negotiation.txt
Lex Fridman,"formulate, what is the problem from an AI perspective? And why is it hard? Was it a challenging game to solve?",Noam Brown - AI vs Humans in Poker and Games of Strategic Negotiation.txt
Noam Brown,"So there's a lot of aspects in diplomacy that make it a huge challenge. First of all, you have the natural language components. And I think this really is what makes it really the most difficult game among like, the major benchmarks, the fact that you have to it's not about moving pieces on the board. Your action space is basically all the different sentences that you could communicate to somebody else in his game. And",Noam Brown - AI vs Humans in Poker and Games of Strategic Negotiation.txt
Lex Fridman,"is there Can we just like linger on that. So it's part of it, like the ambiguity in language, if it was like, very strict, if you narrow the set of possible sentences, you could do it with that simplify the game significantly.",Noam Brown - AI vs Humans in Poker and Games of Strategic Negotiation.txt
Noam Brown,"The real difficulty is the breadth of things that you can talk about. You can have natural language and other games, like Settlers of Catan, for example, you could have a natural language Settlers of Catan AI, but the things that you're going to talk about are basically like, am I treating you to sheep for water, three sheep for wood. Whereas in a game like diplomacy, the breadth of conversations that you're going to have or like, you know, am I going to support you or are you going to support me in return which units are going to do what's what did this other person sit promise you? They're lying because they told this other person that they're going to do this instead. If you helped me out this turn, then in the future, I'll do these things that will help you out. The the depth and breadth of these conversations is really complex. created. And it's all being done in natural language. Now you could approach it. And we actually consider doing this, like, you know, having a simplified language to make this complexity smaller. But ultimately, we thought, the most impactful way of doing this research would be to help address the natural language component head on, and just try to go for the full game upfront.",Noam Brown - AI vs Humans in Poker and Games of Strategic Negotiation.txt
Lex Fridman,"Just looking at sample games, and what the conversations look like greetings, England, this should prove to be a fun game, since all the private press is going to be made public at the end. At the least, it will be interesting to see if the press changes because of that. Anyway, good. Okay. So there's like,",Noam Brown - AI vs Humans in Poker and Games of Strategic Negotiation.txt
Noam Brown,"yeah, that's just kind of like the generic readings at the beginning of the game. I think that the meat comes a little bit later, when you're starting to talk about like, specific strategy and stuff.",Noam Brown - AI vs Humans in Poker and Games of Strategic Negotiation.txt
Lex Fridman,"I agree. There are a lot of advantages to the two of us keeping in touch, and our nation's make strong natural allies in the middle game. So that kind of stuff, making friends making enemies.",Noam Brown - AI vs Humans in Poker and Games of Strategic Negotiation.txt
Noam Brown,"Yeah, right. Like, if you look at the next line, so the person is saying, like, I've heard bits about a Panto, and an octopus opening and basically telling Austria like, hey, just a heads up. You know, I've heard these whispers about like, what might be going on behind your back?",Noam Brown - AI vs Humans in Poker and Games of Strategic Negotiation.txt
Lex Fridman,"Yeah. So there's all kinds of complexities in that, in the, in the language of that, right. Like to interpret what that what that means. It's hard for us humans, but for AI, it's even harder, because you have to understand, like, at every level, the semantics of that,",Noam Brown - AI vs Humans in Poker and Games of Strategic Negotiation.txt
Noam Brown,"right. I mean, there's this is a complexity and understanding when somebody is saying this to me, what does that mean? And then there's also the complexity of like, should I be telling this person this? Like, I've overheard these these whispers? Should I be telling this person that like, Hey, you might be getting attacked by by this other power?",Noam Brown - AI vs Humans in Poker and Games of Strategic Negotiation.txt
Lex Fridman,"Okay, so what how we're supposed to think about okay, so that's the natural language? How do you even begin trying to solve this game? It seems like, this seems like the Turing test on steroids.",Noam Brown - AI vs Humans in Poker and Games of Strategic Negotiation.txt
Noam Brown,"Yeah. And I mean, there's, there's the natural language aspect. And then even besides the natural language aspect, you also have the the cooperative elements of the game. And I think this is actually something that I find really interesting, if you look at all the previous game AI, breakthroughs, they've all happened in these purely adversarial games where you don't actually need to understand how humans play the game. It's all just AI versus AI. Right? Like you look at checkers, chess, go poker, Starcraft Dota. Two, like in some of those cases, they leveraged human data, but they never needed to, they were always just trying to have a scalable algorithm, that then they could throw a lot of computational resources out a lot of memory out. And then eventually, it would converge to an approximation of a Nash equilibrium, this perfect strategy, that in a two player zero sum game guarantees that they're going to be able to not lose to any opponents.",Noam Brown - AI vs Humans in Poker and Games of Strategic Negotiation.txt
Lex Fridman,"So you can leverage self play. So this game, you",Noam Brown - AI vs Humans in Poker and Games of Strategic Negotiation.txt
Noam Brown,"you can leverage self play, but it's no longer sufficient to beat humans.",Noam Brown - AI vs Humans in Poker and Games of Strategic Negotiation.txt
Lex Fridman,"So how do you integrate the human into the loop of this, so what you",Noam Brown - AI vs Humans in Poker and Games of Strategic Negotiation.txt
Noam Brown,"have to do is incorporate human data. And to kind of give you some intuition for why this is the case. Like imagine you're playing a negotiation game like like diplomacy. But you're training completely from scratch. Without any human data that the AI is not going to suddenly like, figure out how to communicate in English, it's going to figure out some weird robot language that only it will understand. And then when you stick that in a game with six other humans, they're going to think this person is talking gibberish, and they're just going to ally with each other and team up against the bot. Or not even keep up against the ball, but just not work with the bot. And so in order to be able to play this game with humans, it has to understand the human way of playing the game, not this machine way of playing the game.",Noam Brown - AI vs Humans in Poker and Games of Strategic Negotiation.txt
Lex Fridman,"Yeah. Yeah, that's fascinating. So right, the nuanced thing to understand because the chess playing program doesn't need to play like a human to beat a human Exactly. But here you have to play like a human in order to beat them.",Noam Brown - AI vs Humans in Poker and Games of Strategic Negotiation.txt
Noam Brown,"Or at least you have to understand how humans play the game so that you can understand how to work with them. If they have certain expectations about what does it mean to be a good ally? What does it mean to have like a reciprocal relationship where we're working together, you have to abide by those conventions? And if you don't, they're just gonna work with somebody else instead.",Noam Brown - AI vs Humans in Poker and Games of Strategic Negotiation.txt
Lex Fridman,"Do you think of this as a clean in some deep sense of the spirit of the Turing test is formulated by Alan Turing is it is some sense this is what the Turing test actually looks like. So because of open ended natural language conversation seems like very difficult to evaluate, like here at a high stakes where humans are trying to win a game that seems like how you actually perform the Turing test.",Noam Brown - AI vs Humans in Poker and Games of Strategic Negotiation.txt
Noam Brown,"I think it's different from the Turing test, like the way that the Turing test is formulated. It's about trying to distinguish a human from a machine and seeing Okay, Did the machine successfully pass as a human in this adversarial setting where the aid where the player is trying to figure out whether it's a machine or human, whereas in diplomacy, it's not about trying to figure out whether this player is a human or machine. It's ultimately about whether I can work with this player, regardless of whether they are human or machine. And can the machine do that better than a human can?",Noam Brown - AI vs Humans in Poker and Games of Strategic Negotiation.txt
Lex Fridman,"Yeah, I'm gonna think about that. But that just feels like the implied requirement for that is for the machine to be human. Like,",Noam Brown - AI vs Humans in Poker and Games of Strategic Negotiation.txt
Noam Brown,"I think that's, I think that's true that if you're going to play in this human game, you have to somehow adapt to the, to the human surroundings, and the human playstyle.",Noam Brown - AI vs Humans in Poker and Games of Strategic Negotiation.txt
Lex Fridman,"And to win, you have to adapt. So you can't if you're the outsider, if you're not human, like I feel like that's a losing strategy.",Noam Brown - AI vs Humans in Poker and Games of Strategic Negotiation.txt
Noam Brown,I think that's I think that's correct.,Noam Brown - AI vs Humans in Poker and Games of Strategic Negotiation.txt
Lex Fridman,Yeah. Yeah. So okay. What are the complexities here? What was your approach to it?,Noam Brown - AI vs Humans in Poker and Games of Strategic Negotiation.txt
Noam Brown,"Before I get to that, one thing I should explain, like why we decided to work on diplomacy here. So basically, what happened is in 2019, I was wrapping up the work on Sixth player poker on Pluribus. And it was trying to think about what to work on next. And I had been seeing like all these other breakthroughs happening in AI, I mean, like, 2019, you have StarCraft, you have alphastar, beating humans and StarCraft, you've got the Dota, two stuff happening at open AI, you have GPT, two or DVD three, I think the GPT, two at the time. And it became clear that AI was progressing really, really rapidly. And people were throwing out these like other games about, you know, what should be the next challenge for multi agent AI. And I just felt like we had to aim bigger. If you look at a game, like chess, or a game like go, they took decades for researchers to to ultimately reach superhuman performance that I mean, like chess took four years of AI research, go took another 20 years. And we thought that diplomacy would be this incredibly difficult challenge that could easily take a decade to make an AI that could play competently. But we felt like That was that was a goal worth aiming for. And so honestly, I was kind of reluctant to work on it at first, because I thought it was like, too far out of the realm of possibility. But, you know, I was talking to a co worker of mine, Adam Lear. And he was basically saying, like, why not aim for it? You know, we'll learn some interesting things along the way. And maybe it'll be possible. And so we decided to go for it. And I think I think it was the right choice, considering just how much progress there there was in AI, and that that progress has continued in the years since",Noam Brown - AI vs Humans in Poker and Games of Strategic Negotiation.txt
Lex Fridman,"so winning and diplomacy. What does that really look like? It means talking to six other players, six other entities, agents, and convincing and convincing them have stuff that you want them to be convinced of? Like, what exactly I'm trying to get like to deeply understand what the problem is.",Noam Brown - AI vs Humans in Poker and Games of Strategic Negotiation.txt
Noam Brown,"Ultimately, the problem is, it's simple to quantify, right? Like, you're going to play this game with humans, and you want your score on average to be as high as possible. You know, if you can say like, I am winning more than any any human alive, then you're a champion diplomacy player. Now, ultimately, we haven't we didn't reach that we got to human level performance, we actually, so we played about 40 games with with real humans online. The bot came in second of all players that played five or more games. And so not like number one, but way, way higher than what was",Noam Brown - AI vs Humans in Poker and Games of Strategic Negotiation.txt
Lex Fridman,"the expertise level? Are they beginners? Are they intermediate players, advanced players? So in",Noam Brown - AI vs Humans in Poker and Games of Strategic Negotiation.txt
Noam Brown,"that sense, that's a great question. So I think this kind of goes into how do you measure the performance in diplomacy. And I would argue that when you're measuring performance in a game like this, you don't actually want to measure it in games with all expert players. It's kind of like if you're developing a self driving car, you don't want to measure that car on the road with a bunch of experts don't traverse Yeah, you want to put it on a road of like an actual American city and see is this car crashing less often than an expert driver would? So that's the metric that we've used. We were saying, like, we're gonna stick this game, we're gonna stick this bot in games with a wide variety of skill levels. And then are we doing better than a stronger expert human player would in the same situation?",Noam Brown - AI vs Humans in Poker and Games of Strategic Negotiation.txt
Lex Fridman,"That's quite brilliant because I played a lot of sports in my life, like as a tennis judo, whatever. And it's somehow almost easier to go against experts almost always. I think they're more predictable in the quality of play. The space of strategies you're operating under is narrower against experts. It's more fun. It's really frustrating against beginners. Also, because Beginners talk trash to you, when they somehow do beat you says, that's a human thing that they are designed to be worried about that. But yeah, the variance in strategies is greater, especially with natural language, it's just all over the place, then.",Noam Brown - AI vs Humans in Poker and Games of Strategic Negotiation.txt
Noam Brown,"Yeah, and honestly, when you look at what makes a good human diplomacy player, obviously, they're able to handle themselves in games with other expert humans, but where they really shine is when they're playing with these weak players. And they know how to take advantage of the fact that they're a weak player that they won't be able to like pull off a stab as well, or that they have certain tendencies. And they can take them under their wing and persuade them to do things that might not even be in their interest. They're really good diplomacy players are able to take advantage of the fact that there that there are some weak players in the game.",Noam Brown - AI vs Humans in Poker and Games of Strategic Negotiation.txt
Lex Fridman,"Okay, so if you have to incorporate human play data, how do you do that? How do you do that in order to train an AI system to play diplomacy?",Noam Brown - AI vs Humans in Poker and Games of Strategic Negotiation.txt
Noam Brown,"Yeah, so that's, that's really the crux of the problem. How do we leverage the benefits of self play that have been so successful in all these other previous games, while keeping the strategy as as human compatible as possible. And so what we did is we first trained a language model. And then we made that language model controllable. On a set of a set of intents, we call intents, which are basically like an action that we want to play, and an action that we would like the other player to play. And so this gives us a way to generate dialogue, that's not just trying to imitate the human style, whatever a human would say, in this situation, but to actually give it a an intent of purpose in its communication, we can talk about a specific move, or we can make a specific request. And the determination of what that move is that we're discussing comes from strategic strategic reasoning model that uses reinforcement learning and planning.",Noam Brown - AI vs Humans in Poker and Games of Strategic Negotiation.txt
Lex Fridman,So the computing the intense for all the players. How's that done? Just as a as a starting point? Is that with reinforcement learning? Or is that just optimal? Determining what the optimal is for intense,Noam Brown - AI vs Humans in Poker and Games of Strategic Negotiation.txt
Noam Brown,"it's a combination of reinforcement learning and planning, actually very similar to how you approach how we approached poker and how people approached like Chess and Go as well. We're using self play, and and search to try to figure out what are what is an optimal move for us, and what is a desirable move that we would like this other player to play? Now, the difference between the way that we approached reinforcement learning and search in this game, versus those previous games, is that we have to keep it human compatible, we have to understand how the other person is likely to play rather than just assuming that they're going to play like a machine,",Noam Brown - AI vs Humans in Poker and Games of Strategic Negotiation.txt
Lex Fridman,"and how language gets them to play in a way that maximize the chance of following the intent you want them to follow. Okay, how do you how do you do that? How do you? How do you connect language to intent,",Noam Brown - AI vs Humans in Poker and Games of Strategic Negotiation.txt
Noam Brown,"so the way that RL and planning is done is actually not using language. So we're coming up with this like plan for the action that we're gonna play in the other person's gonna play. And then we feed that action into the dialogue model, that will then send a message according to those plans.",Noam Brown - AI vs Humans in Poker and Games of Strategic Negotiation.txt
Lex Fridman,"So the language model there is mapping action to message to message, one word at a time.",Noam Brown - AI vs Humans in Poker and Games of Strategic Negotiation.txt
Noam Brown,"Basically, one message at a time. So will will feed into the dialogue model, like here are the actions that you should be discussing, here's the message, here's like the, the contents of the message that we would like you to send, and then it will actually generate a message that corresponds to that, okay, does this actually work? It works surprisingly well.",Noam Brown - AI vs Humans in Poker and Games of Strategic Negotiation.txt
Lex Fridman,"Okay, how? And the number of ways it probably goes horribly, I would have imagined it goes horribly wrong. So how the heck is it effective at all?",Noam Brown - AI vs Humans in Poker and Games of Strategic Negotiation.txt
