speaker,speech,document
Noam Brown,"A lot of people were saying like, Oh, this whole idea of game theory, it's just nonsense. And if you really want to make money you got to like look into the other person's eyes and read their soul and figure out what cards they have. But what happened was where we played our bot against four top heads up no limit Hold'em poker players, and the bot wasn't trying to adapt to them. It wasn't trying to exploit them. It wasn't trying to do these mind games, it was just trying to approximate the Nash equilibrium, and it crushed them.",Noam Brown - AI vs Humans in Poker and Games of Strategic Negotiation.txt
Lex Fridman,"The following is a conversation with Noah Brown, research scientist at fair Facebook AI research group at meta AI. He co created the first AI system that achieved superhuman level performance. In No Limit Texas Hold'em both heads up and multiplayer. And now recently, he co created an AI system that can strategically out negotiate humans using natural language in a popular board game called diplomacy, which is a war game that emphasizes negotiation. This is the LEX Friedman podcast to support it, please check out our sponsors in the description. And now, dear friends, here's Noam Brown. You've been a lead on three amazing AI projects. So we got libres that solved or at least achieved human level performance on No Limit Texas Hold'em poker with two players heads up. You got Pluribus that solved No Limit Texas Hold'em poker with six players. And just now you have Cicero these are all names of systems that solved or achieved human level performance on the game of diplomacy, which for people who don't know, is a popular strategy board game. It was loved by JFK, John F. Kennedy and Henry Kissinger and many other big famous people in the decades since so let's talk about poker and diplomacy today. First poker what is the game of No Limit Texas Hold'em? And How's it different from chess?",Noam Brown - AI vs Humans in Poker and Games of Strategic Negotiation.txt
Noam Brown,"Well, No Limit Texas Hold'em poker is the most popular variant of poker in the world. So you know you go to a casino you play sit down at the poker table, the game that you're playing is No Limit Texas Hold'em. If you watch movies about poker, like Casino Royale, or Rounders, the game that they're playing is No Limit Texas Hold'em poker. Now it's very different from limit Hold'em. And you can bet any amount of chips that you want. And so the stakes escalate really quickly, you start out with like one or $2 in the pot. And then by the end of the hand, you've got like $1,000 in there, maybe",Noam Brown - AI vs Humans in Poker and Games of Strategic Negotiation.txt
Lex Fridman,"two, the option to increase the number very aggressively, very quickly is always there,",Noam Brown - AI vs Humans in Poker and Games of Strategic Negotiation.txt
Noam Brown,"right? The no limit aspect is there's no limit to how much you can bet. You know, you can limit Hold'em, there's like $2 in the pot, you can only bet like $2. But if you got $10,000 in front of you, you're always welcome to put $10,000 into the pot.",Noam Brown - AI vs Humans in Poker and Games of Strategic Negotiation.txt
Lex Fridman,"So I've had a chance to hang out with Phil Hellmuth, who plays all these different variants of poker. And correct me if I'm wrong, but it seems like no limit rewards crazy. versus the other ones rewards more kind of calculated strategy, or no, because you're sort of looking from an from an analytic perspective is is strategy also rewarded. In No Limit Texas Hold'em.",Noam Brown - AI vs Humans in Poker and Games of Strategic Negotiation.txt
Noam Brown,"I think both variants reward strategy. But I think what's different about no limit Hold'em is it's it's much easier to get jumpy, you know, you go in there thinking you're going to lose, you're going to play for like $100 or something. And suddenly, there's like, you know, $1,000 in the pot, a lot of people can't handle that. Can you define jumping, when you're playing poker, you always want to choose the action that's going to maximize your expected value. It's kind of like kind of like with investing, right? Like, if you're ever in a situation where you're, the amount of money that's at stake is is going to have a material impact on your life, then you're going to play in a more risk averse style. You know, if somebody makes a huge bet, you're going to if you're playing No Limit Hold'em, and somebody makes a huge bet, there might come a point where you're like, This is too much money for me to handle like I can't risk this amount. And that's what throws a lot of people off. So that's the big difference, I think, between no limit and limit.",Noam Brown - AI vs Humans in Poker and Games of Strategic Negotiation.txt
Lex Fridman,"What about on the action side when you're actually making that big bet? That's what I mean by crazy. I was trying to refer to the technical, the technical term of crazy meaning, use the big jump in the bet to completely throw off the other person in terms of their ability to reason optimally.",Noam Brown - AI vs Humans in Poker and Games of Strategic Negotiation.txt
Noam Brown,"I think that's right. I think one of the key strategies in poker is to put the other person into an uncomfortable position. And if you're doing that, then you're you're playing poker well, and there's a lot of opportunities to do that. And no limit Hold'em. You know, you can have like $50 in there, you throw in $1,000 bet. And you know that sometimes if you do it right, it puts the other person in a really tough spot. Now, it's also possible that you make huge mistakes that way. And so it's really easy to lose a lot of money and no limit Hold'em. If you don't know what you're doing Mmm. But there's a lot of upside potential to",Noam Brown - AI vs Humans in Poker and Games of Strategic Negotiation.txt
Lex Fridman,"so when you build systems AI systems that play these games, we'll talk about poker, we'll talk about diplomacy. Are you? Are you drawn in, in part by the beauty of the game itself AI aside, or is it to you primarily a fascinating problem set for the AI to solve?",Noam Brown - AI vs Humans in Poker and Games of Strategic Negotiation.txt
Noam Brown,"I'm joined by the beauty of the game when I, I started playing poker when I was in high school. And the idea to me that there is a correct and objectively correct way of playing poker. And if you could figure out what that is, then you're, you know, you're making unlimited money, basically. That's like a really fascinating concept to me. And so I was fascinated by the strategy of poker, even when I was like, 16 years old. It wasn't until much later that I actually worked on poker API's.",Noam Brown - AI vs Humans in Poker and Games of Strategic Negotiation.txt
Lex Fridman,"So there was a sense that you can solve poker, like, in a way you can solve chess, for example, checkers. I believe checkers got solved, right? You think",Noam Brown - AI vs Humans in Poker and Games of Strategic Negotiation.txt
Noam Brown,"checkers, checkers is completely solved optimal, optimal strategy, it's impossible to beat the AI.",Noam Brown - AI vs Humans in Poker and Games of Strategic Negotiation.txt
Lex Fridman,"Yeah. And so in that same way, you could technically solve chess,",Noam Brown - AI vs Humans in Poker and Games of Strategic Negotiation.txt
Noam Brown,"you could solve chess, you could solve poker, you could solve poker. So this is this gets into the concept of a Nash equilibrium. So it",Noam Brown - AI vs Humans in Poker and Games of Strategic Negotiation.txt
Lex Fridman,is a Nash equilibrium. Okay. So,Noam Brown - AI vs Humans in Poker and Games of Strategic Negotiation.txt
Noam Brown,"in any finite two player zero sum game, there is an optimal strategy, that if you play it, you are guaranteed to not lose an expectation no matter what your opponent does. And this is kind of a radical concept to a lot of people. But it's true in chess, it's true in poker, it's true in any finite two player zero sum game. And to get some intuition for this, you can think of Rock Paper, scissors, and Rock Paper, Scissors. If you randomly choose between throwing rock, paper and scissors with equal probability, then no matter what your opponent does, you're not going to lose an expectation, you're not going to lose an expectation in the long run. Now, the same is true for poker, there exists some strategy, some really complicated strategy, that if you play that you are guaranteed to not lose money in the long run. And I should say, this is for two player poker six player poker is a different story.",Noam Brown - AI vs Humans in Poker and Games of Strategic Negotiation.txt
Lex Fridman,"Yeah, it's a beautiful, giant mess. When you say in expectation, you're guaranteed not to lose in expectation, what does an expectation mean?",Noam Brown - AI vs Humans in Poker and Games of Strategic Negotiation.txt
Noam Brown,"pokers a very high variance game. So you're going to have hands where you win, you're going to have hands with your lose, even if you're playing the perfect strategy, you can't guarantee they're gonna win every single hand. But if you play for long enough, then you're guaranteed to at least breakeven, and in practice, probably one.",Noam Brown - AI vs Humans in Poker and Games of Strategic Negotiation.txt
Lex Fridman,"So that's an expectation, the size of your stack, generally speaking. Now, that doesn't include anything about the fact that you can go broke, it doesn't include any of those kinds of normal real world limitations, you're talking in a in a theoretical world. What about the the zero sum aspect, how big of a constraint is that how big of a constraint is finite?",Noam Brown - AI vs Humans in Poker and Games of Strategic Negotiation.txt
Noam Brown,"So finite, it's not a huge constraint. So I mean, most games that you play are finite in size. It's also true actually, that there exists this like perfect strategy in many infinite games as well, technically, the game has to be compact. There are like some edge cases where you don't have a Nash equilibrium in a two player zero sum game. So you can think of a game where you like, you know, for playing a game where whoever names, the bigger number is the winner, there's no Nash equilibrium to that game. 1718,",Noam Brown - AI vs Humans in Poker and Games of Strategic Negotiation.txt
Lex Fridman,"but you'd be the one again, you're good at this, played a lot of games. Okay, so that's, and then the zero sum aspect, the 00 sum",Noam Brown - AI vs Humans in Poker and Games of Strategic Negotiation.txt
Noam Brown,"aspects. So there exists a Nash equilibrium in non two player zero sum games as well. And by the way, just to clarify what I mean by two player zero sum, I mean, there's two players, and whatever one player wins, the other player loses. So if you're playing poker, and I went $50, that means that you're losing $50. Now, outside of two player zero sum games, there still exist Nash equilibria. But they're not as meaningful. Because you know, you can think of a game like risk. If everybody else at the on the board decides to team up against you and take you out. There's no perfect strategy you can play that's going to guarantee that you win, there is nothing you can do. So outside of two player zero sum games, there's no guarantee that you're going to win by playing a Nash equilibrium.",Noam Brown - AI vs Humans in Poker and Games of Strategic Negotiation.txt
Lex Fridman,"Have you ever tried to model in the other aspects of the game, which is like the pleasure you draw from playing the game. And then if you're a professional poker player, if you're exciting, even if you lose, the, you know, the money you would get from the attention you get to the sponsor, and all that kind of stuff, is that that'd be a fun thing to model to model in areas that make it sort of super complex to include the human factor. And this is full complexity.",Noam Brown - AI vs Humans in Poker and Games of Strategic Negotiation.txt
Noam Brown,"I think you bring up a couple of good points there. So I think a lot of professional poker players I mean, they get a huge amount of money not from the actually playing poker but from the sponsorships and having a personality that people want to tune in and watch that. That's a big, that's a big way to make a name for yourself in poker.",Noam Brown - AI vs Humans in Poker and Games of Strategic Negotiation.txt
Lex Fridman,"I just wonder from an AI perspective, if you create and we'll talk about this more, maybe it AI says Some that also talks trash and all that kind of stuff, that that becomes part of the function to maximize. So it's not just optimal poker play. Maybe sometimes you want to be chaotic, maybe sometimes you want to be suboptimal, you lose the chaos. And maybe sometimes you want to be overly aggressive. Because the audience loves that. Yeah, say,",Noam Brown - AI vs Humans in Poker and Games of Strategic Negotiation.txt
Noam Brown,I think I think what you're getting at here is that there's a difference between making an AI that wins a game and an AI. That's fun to play with. Yeah. Yeah. And fun,Noam Brown - AI vs Humans in Poker and Games of Strategic Negotiation.txt
Lex Fridman,"to watch. So those are all different things fun to play with, and fun to watch. Yeah, and I",Noam Brown - AI vs Humans in Poker and Games of Strategic Negotiation.txt
Noam Brown,"think, you know, I've, I've heard talks from like game designers, and they say, like, you know, people that work on AI for actual recreational games that people play. And they say, yeah, there's a big difference between trying to make an AI that actually wins, and you look at a game like civilization. The way that the AIS play is not optimal for trying to win. They're, they're playing a different game. They're trying to have personalities, they're trying to be fun and engaging. And that makes for a better game.",Noam Brown - AI vs Humans in Poker and Games of Strategic Negotiation.txt
Lex Fridman,"Yeah. And we also talked about NPCs. I just talked to Todd Howard, who is the creator of Fallout and the Elder Scrolls series and Starfield, the new game coming out. And the Creator what I think is the greatest game of all time, which is Skyrim. And the NPCs. There, the AI that governs that whole game is very interesting, but the NPC is also super interesting. And considering what language models might do, to NPCs in an open world, RPG role playing game is super exciting.",Noam Brown - AI vs Humans in Poker and Games of Strategic Negotiation.txt
Noam Brown,"Yeah, honestly, um, I think this is like one of the first applications where we're going to see like real consumer interaction with large language models. I guess like Elder Scrolls six is in development. Now. They're probably like, pretty close to finishing it. But I would not be surprised at all, if Elder Scrolls seven was using large language models for their NP.",Noam Brown - AI vs Humans in Poker and Games of Strategic Negotiation.txt
Lex Fridman,"There. I mean, I'm not saying anything, saying anything. Me speculating, not you know what, but there's, they're just releasing the stuff feel good. They do one game at a time. Yeah. And so whatever it is, whenever the data is, I don't know what the date is calm down. But it would be I don't know, like 2024 2526. So it's actually very possible that would include language models.",Noam Brown - AI vs Humans in Poker and Games of Strategic Negotiation.txt
Noam Brown,"I was listening to this, this talk by a gaming executive when I was in grad school. And one of the questions that the person in the audience asked is, why are all these games so focused on fighting and killing, and the person responded that it's just so much harder to make an AI that can talk with you and cooperate with you than it is to make an AI that can fight you. And I think once this technology develops further, and you can have, you can reach a point where like, not every single line of dialogue has to be scripted, it unlocks a lot of potential for new kinds of games, like much more like positive interactions that are not so focused on fighting, I'm really looking forward to that",Noam Brown - AI vs Humans in Poker and Games of Strategic Negotiation.txt
Lex Fridman,"might not be positive might be just drama. So you'll be in that like a Call of Duty game, instead of doing the shooting, you'll just be hanging out. And like arguing with an AI about like, like passive aggressive, and then you won't be able to sleep that night, you have to return continue the argument that you were emotionally hurt. I mean, yeah, I think that's actually an exciting world, whatever, whatever is the drama, the chaos, that we love, the push and pull of human connection, I think it's possible to do that in the video game world. And I think you could be messier and make more mistakes in the video game world, which is why it'd be a nice place. And also, it doesn't have a deep have as deep of a real psychological impact. Because inside video games, it's kind of understood that urine is not a real world. So whatever crazy stuff AI does, we have some flexibility to play. Just like with a game of diplomacy, it's a game. This is not real geopolitics, not real war, it's, it's a game. So you can you can have a little bit of fun. A little bit of chaos. Okay, back to how do we find the Nash equilibrium?",Noam Brown - AI vs Humans in Poker and Games of Strategic Negotiation.txt
Noam Brown,"Alright, so there's different ways to find an equilibrium. So the way that we do it is with this process called self play. Basically, we have this algorithm that starts by playing totally randomly, and it learns how to play the game by playing against itself. So it will start playing the game totally randomly. And then, you know, if it's playing poker, it'll eventually like, get to the end of the end of the game and make $50. And then it will like review all the decisions that I've made along the way, and say, What would have happened if I had chosen this other action instead? You know, if I had raised here instead of called, what would the other player have done? And because it's playing against a copy of itself, it's able to do that counterfactual reasoning, so they can say, Okay, well, if I took this action, and the other person takes this action, and then I take this action, and eventually I make $150 instead of 50. And so it updates the regret value for that action. Regret is basically like how much does it regret having not played that action in the past? And when it encounters that same situation, again, it's going to pick actions that have higher regret with higher probability. Now, it'll just keep simulating the games this way, it'll keep, you know, accumulating regrets for different situations. And in the long run, if you pick actions that have high regret, with higher probability in the correct way, it's proven to converge to a Nash equilibrium.",Noam Brown - AI vs Humans in Poker and Games of Strategic Negotiation.txt
Lex Fridman,"Even for super complex games, even for imperfect information games,",Noam Brown - AI vs Humans in Poker and Games of Strategic Negotiation.txt
Noam Brown,"it's true for all games it's true for it's true for chess, it's true for poker, it's particularly useful for poker.",Noam Brown - AI vs Humans in Poker and Games of Strategic Negotiation.txt
Lex Fridman,"So this is the method of counterfactual regret minimization, this is counterfactual regret minimization that doesn't have to do with self play has to do with just any, if you follow this kind of process of play or not, you will be able to arrive at an optimal set of actions.",Noam Brown - AI vs Humans in Poker and Games of Strategic Negotiation.txt
Noam Brown,"So this counterfactual, regret minimization is a kind of self play. It's a principle kind of self play, that's proven to converge to Nash equilibria. Even in imperfect information games. Now you can have other forms of self play, and people use other forms of self playing for perfect information games. Where you have more flexibility, the algorithm doesn't have to be as theoretically sound in order to converge to that classic games, because there's, it's a simpler setting. Sure. So",Noam Brown - AI vs Humans in Poker and Games of Strategic Negotiation.txt
Lex Fridman,"I kind of in my brain, the word self play has mapped in neural networks, but we're speaking something bigger than just the one that works. It could be anything. If the self playing mechanism is just the mechanism of a system playing itself.",Noam Brown - AI vs Humans in Poker and Games of Strategic Negotiation.txt
Noam Brown,"Exactly. Yeah. Self play is not tied specifically to neural nets. It's a kind of reinforcement learning, basically. Okay. And I would also say, this process of like, trying to reason oh, what would the value had been if I had taken this other action instead? This is very similar to how humans learn to play a game like poker, right? Like you probably played poker before and with your friends, you probably asked like, Oh, what do you have called me if I raise their you know, and that's, that's a person trying to do the same kind of like learning from a counterfactual that the AI is doing.",Noam Brown - AI vs Humans in Poker and Games of Strategic Negotiation.txt
Lex Fridman,"Okay. And if you do that, at scale, you're going to be able to learn an optimal policy. Yep.",Noam Brown - AI vs Humans in Poker and Games of Strategic Negotiation.txt
Noam Brown,"Now where the neural nets come in, I said, like, Okay, if it's in that situation again, then it will choose the action that has high regret. Now, the problem is that poker is such a huge game. You know, I think it No Limit Texas Hold'em. The version that we were playing has 10 to the 161 different decision points, which is more than the number of atoms in the universe squared.",Noam Brown - AI vs Humans in Poker and Games of Strategic Negotiation.txt
Lex Fridman,"That's heads up. That's heads up. Yeah. 10 To the one six to one, you said,",Noam Brown - AI vs Humans in Poker and Games of Strategic Negotiation.txt
Noam Brown,"Yeah, I mean, it depends on the number of chips that you have the stacks and everything, but like the version that we were playing was 10 to the 161,",Noam Brown - AI vs Humans in Poker and Games of Strategic Negotiation.txt
Lex Fridman,which I assume would be a somewhat simplified version anyway. Because the about there's some like step function you had for like bets.,Noam Brown - AI vs Humans in Poker and Games of Strategic Negotiation.txt
Noam Brown,"Oh, no, no, that's, that's I'm saying, like, we played the full game, you can bet whatever amount you want. And maybe it was constrained in like, what it considered for bet sizes, but the, the person on the other side could bid whatever they wanted. Yeah,",Noam Brown - AI vs Humans in Poker and Games of Strategic Negotiation.txt
Lex Fridman,"I mean, 161 plus or minus 10, doesn't matter.",Noam Brown - AI vs Humans in Poker and Games of Strategic Negotiation.txt
Noam Brown,"And so the the way neural nets help out here is, you know, you don't have to run into the same exact situation, because that's never gonna happen. Again, the odds of you running into the same exact situation are pretty slim. But if you run into a similar situation, then you can generalize from other states that you've been in that kind of looked like that one. And you can say like, well, these other situations, I had high regret for this action. And so maybe I should play that action here as well,",Noam Brown - AI vs Humans in Poker and Games of Strategic Negotiation.txt
Lex Fridman,"which is the more complex game, chess, or poker, or go or poker,",Noam Brown - AI vs Humans in Poker and Games of Strategic Negotiation.txt
Noam Brown,"do, you know? That is a controversial question. Okay, I'm gonna post like",Noam Brown - AI vs Humans in Poker and Games of Strategic Negotiation.txt
Lex Fridman,somebody screaming on Reddit right now depends on which subreddit you're on Chester's poker.,Noam Brown - AI vs Humans in Poker and Games of Strategic Negotiation.txt
Noam Brown,I'm sure like David Silva is gonna get really angry at me. I'll say I'm gonna say poker actually. And I think for a couple reasons. They're not,Noam Brown - AI vs Humans in Poker and Games of Strategic Negotiation.txt
Lex Fridman,here to defend themselves. So,Noam Brown - AI vs Humans in Poker and Games of Strategic Negotiation.txt
Noam Brown,"first of all, you have the imperfect information aspects. And so it's that we can go into that, but like, once you introduce imperfect information, things get much more complicated.",Noam Brown - AI vs Humans in Poker and Games of Strategic Negotiation.txt
Lex Fridman,"So we should say, maybe you can describe what is seen to the players what is not seen in the game of Texas Hold'em.",Noam Brown - AI vs Humans in Poker and Games of Strategic Negotiation.txt
