speaker,speech,document
Noam Brown,"there was there was something really interesting that we observed with libres. So humans, when they're playing poker, they usually size their bets relative to the size of the pot. So you know, if the pot has $100 in there, maybe you bet like $75, somewhere around somewhere between like 50 and $100. And with libres, we gave it the option to basically bet whatever it wanted, it was actually really easy for us to say like, Oh, if you want, you can bet like 10 times the pot, and we didn't think would actually do that. It was just like, why not give it the option. And then during the competition, it actually started doing this. And by the way, this is like a very last minute decision on our part to add this option. And so we did not read it, we did not think the bot would would do this. And I was actually kind of worried when it did start to do this, like, oh, is this a problem? Like humans don't do this, like, is it screwing up? But it would put the humans into really difficult spots when it would do that? Because, you know, you can imagine like you have the second best hand that's possible given the board. And you're thinking like, Oh, you're in a really great spot here. And suddenly the bot bets $20,000 into you know, $1,000 pot and and it's basically saying like, I have the best hand or I'm bluffing and you having the second best hand like now you got a really tough choice to make. And so the humans would sometimes think like five or 10 minutes about what Like, what do you do? Should should I call should I fold? And? And when I saw the humans like really struggling with that decision, like, that's when I realized like, oh, actually this is maybe a good thing to do after all.",Noam Brown - AI vs Humans in Poker and Games of Strategic Negotiation.txt
Lex Fridman,"And of course, the system was a no, that is making, again, like we said that is putting them in a tough spot. It's it's, it's just that's part of the optimal the game theory optimal,",Noam Brown - AI vs Humans in Poker and Games of Strategic Negotiation.txt
Noam Brown,"right from the bots perspective, it's just, it's just doing the thing that's going to make it the most money. And the fact that it's putting the humans in a difficult spot, like that's just, you know, a side effect of that. And this was I think, the the one thing I mean, there were a few things that the humans walked away from, but this was the, the number one thing that humans walked away from the competition saying, like, we need to start doing this. And now these over bets, what are called over bets, have become really common in high level poker play.",Noam Brown - AI vs Humans in Poker and Games of Strategic Negotiation.txt
Lex Fridman,Have you ever talked to somebody like Dan on the ground about this? He seems to be a student of the game.,Noam Brown - AI vs Humans in Poker and Games of Strategic Negotiation.txt
Noam Brown,"I did actually have a conversation with Daniel de Granja once. Yeah, I was. I was visiting the Isle of Man to talk to PokerStars about AI. And Daniel and Ronnie was there. We had dinner together with some other people. And yeah, he's he was really interested in it. He mentioned that he was like, you know, excited about like, learning from these API's.",Noam Brown - AI vs Humans in Poker and Games of Strategic Negotiation.txt
Lex Fridman,"He wasn't scared. He was excited. He was excited and,",Noam Brown - AI vs Humans in Poker and Games of Strategic Negotiation.txt
Noam Brown,"and he all he honestly he wanted to play against the bot. He thought he he thought he had a decent chance of beating it. I think he's, you know, this was like, several years ago, and I think it was like, not as clear to everybody that you know, the AIS were taking over. I think now people recognize that like, if you're playing against a bot, there's like no chance that you have in a game like poke so",Noam Brown - AI vs Humans in Poker and Games of Strategic Negotiation.txt
Lex Fridman,"consistently, the bots will win. The Bots of heads up and in in other variants, too. So multiple multiple six player, Texas Hold'em, No Limit Texas Hold'em was the bots one.",Noam Brown - AI vs Humans in Poker and Games of Strategic Negotiation.txt
Noam Brown,"Yeah, that's the case. So I think there is some debate about like, is it true for every single variant of poker, I think, I think for every single variant of poker, if somebody really put in the effort, they can make an AI that would beat all humans at it. We've focused on the most popular variants, so heads up No Limit Texas Hold'em. And then we follow that up with with six player poker as well, where he managed to make about that beat expert human players. And I think even there now, it's pretty clear that humans don't stand a chance. See, I would",Noam Brown - AI vs Humans in Poker and Games of Strategic Negotiation.txt
Lex Fridman,"love to hook up an AI system that looks at EEG, like how like, actually tries to optimize the toughness of the spot it puts a human in. I would, I would love to see how different is that from the game theory optimal. So you try to maximize the heart rate of the human player. Like the freaking out over a long period of time, I wonder if there's going to be different strategies that emerge that are close in terms of effectiveness, because something tells me you could still be achieve superhuman level performance by just making people sweat.",Noam Brown - AI vs Humans in Poker and Games of Strategic Negotiation.txt
Noam Brown,"I feel like that there's a good chance that that is the case. Yeah, if you're able to see like that, it's like it's like a decent proxy for score, right. And this is actually like the the common poker wisdom when they're taught where they're teaching players before, there are bots. And they were trying to teach people how to play poker, they would say like, the key to the game is to put your opponent into difficult spots. It's a good, a good estimate for if you're making the right decision.",Noam Brown - AI vs Humans in Poker and Games of Strategic Negotiation.txt
Lex Fridman,So what else can you say about the fundamental role of search in poker? And maybe if you can also relate it to chess and go in these games? What's the role of search to solving these games?,Noam Brown - AI vs Humans in Poker and Games of Strategic Negotiation.txt
Noam Brown,"Yeah, I think a lot of people under this is true for the general public. And I think it's true for the AI community. A lot of people underestimate the importance of search for these kinds of gaming results. An example of this is TD Gammon that came out in 1992. This was the first real instance of a neural net being used in a game AI. So landmark achievement, it was actually the inspiration for Alpha zero. And it used search, it used to play search to figure out its next move. You got deep blue there, he was very heavily focused on search, looking many, many moves ahead farther than any human could. And that was key for why it won. And then even with something like AlphaGo, I mean, AlphaGo is commonly hailed as a landmark achievement for neural nets. And it is, but there's also this huge component of search Monte Carlo Tree Search to AlphaGo. That was key absolutely essential for the AI to be able to be top humans. I think a good example of this is you look at the latest versions of alpha of AlphaGo. Like it was called Alpha zero. And there's this metric called EA low rating where you can compare different humans you can compare bots to humans. Now, a top human player is around 3600 kilo, maybe a little bit higher now. Alpha zero the strongest version is around 5200 kilo by If you take out the search that's being done at test time, and by the way, what I mean by search is the planning ahead, the thinking of like, Oh, if I move my, if I placed this stone here, and then he does this, and then you look like five moves ahead, and you see like what the board state looks like. That's what I mean by search. If you take out the search, that's done during the game, the ELO rating drops to around 3000. So even today, what seven years after AlphaGo, if you take out the Monte Carlo Tree Search that's being done, at one playing against the human, the bots are not superhuman, nobody has made a raw neural net, that is superhuman and go,",Noam Brown - AI vs Humans in Poker and Games of Strategic Negotiation.txt
Lex Fridman,"that's worth lingering on. That's, that's quite profound. So without search, that just means looking at the next move, and saying, This is the best move. So having a function that estimates accurately what the best move is,",Noam Brown - AI vs Humans in Poker and Games of Strategic Negotiation.txt
Noam Brown,"that's right, without search. Yeah, and all these bots, they have the what's called a policy network, where it will tell you this is what the neural net thinks is the next best move. And it's kind of like a the intuition that a human has, you know, the the human looks at the board and, and any go or chess master will be able to tell you like, oh, instantly, here's what I think the right move is. And the bot is able to do the same thing. But just like how a human Grandmaster can make a better decision. If they have more time to think when you add on this Monte Carlo Tree Search, the bot is able to make a better decision.",Noam Brown - AI vs Humans in Poker and Games of Strategic Negotiation.txt
Lex Fridman,"Yeah, I mean, of course, a human is doing something like search in their brain, but it's not. I hesitate to draw a hard line. But it's not like Monte Carlo Tree Search. It's more like sequential language model generation. So it's like a different it's a neural network is doing the searching and wonder what the human brain is doing in terms of searching. Because you're doing that like computation, humanist computing, they have intuition they've got they have a really strong ability to estimate, you know, amongst the top players of what is good and not position without calculating all the details. But they're still doing search in their head was a different kind of search. Have you ever thought about like, what is the difference between the human the search that the human is performing versus what computers are doing?",Noam Brown - AI vs Humans in Poker and Games of Strategic Negotiation.txt
Noam Brown,"I have thought a lot about that. And I think it's a really important question. So the AI in alpha and alphas in AlphaGo, or any of these guys, they're all doing Monte Carlo Tree Search, which is a particular kind of search. And it's actually a symbolic tabular search, it uses the neural net to guided search, but it isn't actually like, full full on neural net. Now, that kind of search is very successful in these kinds of like perfect information board games, like chess, and go. But if you take it to a game like poker, for example, it doesn't work, it can't, it can't understand the concept of hidden information, it doesn't understand the balance that you have to strike between, like the amount that you're raising versus the amount that you're calling. And in every one of these games, you see a different kind of search. And the human brain is able to plan for all these different games in a very general way. Now, I think that's one thing that we're missing from Ai today. And I think it's a really important missing piece. The ability to plan and reason were generally across a wide variety of different settings,",Noam Brown - AI vs Humans in Poker and Games of Strategic Negotiation.txt
Lex Fridman,"in a way where the general reasoning makes you better at each one of the games. Yeah, worse.",Noam Brown - AI vs Humans in Poker and Games of Strategic Negotiation.txt
Noam Brown,"Yeah. So you can kind of think of it as like neural nets today, they'll give you like, transformers, for example, are super general. But you know, they'll give you it'll output an answer in like, 100 milliseconds. And if you tell it, like, Oh, you got five minutes to give me a decision, you know, feel free to take more time to make a better decision. It's not gonna know what to do with that. But a human, if you're playing a game like chess, they're gonna give you a very different answer, depending on if you say, Oh, you got 100 milliseconds, or you've got five minutes.",Noam Brown - AI vs Humans in Poker and Games of Strategic Negotiation.txt
Lex Fridman,"Yeah, there. I mean, that when people have started using red transformers, language models, like the iterative way that does improve the answer, or like showing the work, they've had this kind of idea.",Noam Brown - AI vs Humans in Poker and Games of Strategic Negotiation.txt
Noam Brown,"Yeah, they got this thing called chain of thought reasoning. And that's, I think, super promising, right? Yeah, I think and I think it's a good step in the right direction. I would kind of like, say it's similar to Monte Carlo rollouts in in a game like chess, there's a kind of search that you can do, where you're saying, like, I'm going to roll out my intuition and see like, without really thinking, you know, what are the better decisions I can make farther down the path? What would I do if I just acted according to intuition for the next 10 moves? And that gets you an improvement, but I think that there's much, much richer kinds of of planning that we could do.",Noam Brown - AI vs Humans in Poker and Games of Strategic Negotiation.txt
Lex Fridman,"So one, the brightest actually beat the poker players. What did that feel like? What was that? I mean, actually, on that day, what were you feeling like we nervous? I mean, poker was one of the games that he thought like is not going to be solvable because it's the human factor. So at least in the near It is we tell ourselves the human factor so fundamental to the game of poker.",Noam Brown - AI vs Humans in Poker and Games of Strategic Negotiation.txt
Noam Brown,"Yeah, the librettist competition was super stressful for me. Also, I mean, I was working on this like, basically continuously for a year leading up to the competition. I mean, for me, it became like very clear, like, Okay, this is the search technique, this is the approach that we need. And then I spent a year working on this pretty much like nonstop.",Noam Brown - AI vs Humans in Poker and Games of Strategic Negotiation.txt
Lex Fridman,"Can we actually get into details? Like what programming languages is it written in? was some interesting implementation details that are like, fun slash painful?",Noam Brown - AI vs Humans in Poker and Games of Strategic Negotiation.txt
Noam Brown,"Yeah. So one of the interesting things about LeBron is, is that we had no idea what the bar was to actually beat top humans. We could play against like our prior bots. And that kind of gives us some sense of like, are we making progress? Are we going in the right direction, but we had no idea like what the bar actually was. And so we threw a huge amount of resources at trying to make the strongest bot possible. So we use C++, it was paralyzed. We were using I think, like 1000 CPUs, maybe, maybe more actually. And, you know, today that sounds like nothing. But for a grad student back in 2016, that was a huge amount of resources, it was still",Noam Brown - AI vs Humans in Poker and Games of Strategic Negotiation.txt
Lex Fridman,"a lot for even a new grad student today, it's still tough to get, or even to allow yourself to think in that in terms of scale at CMU, at MIT, anything like that?",Noam Brown - AI vs Humans in Poker and Games of Strategic Negotiation.txt
Noam Brown,"Yeah. And, you know, talking about terabytes of memory. So it was a very paralyzed. And it had to be very fast, too. Because the more games that you could simulate, the stronger the bot would be.",Noam Brown - AI vs Humans in Poker and Games of Strategic Negotiation.txt
Lex Fridman,"So is there some like John Carmack style, like, efficiencies, you have to come up with like, an efficient way to represent a hand, all that kind of stuff,",Noam Brown - AI vs Humans in Poker and Games of Strategic Negotiation.txt
Noam Brown,"there are all sorts of optimizations that I had to make to try to get this thing to run as fast as possible. They were like, how do you minimize the latency? How do you like, you know, package things together, so that like, you minimize the amount of communication between the different nodes. How do you like optimize the algorithm so that you can, you know, try to squeeze out more and more from the game that you're actually playing? All these kinds of different decisions that that I, you know, had to make?",Noam Brown - AI vs Humans in Poker and Games of Strategic Negotiation.txt
Lex Fridman,"Just a fun question, what what Id did you use? What? For for C++?",Noam Brown - AI vs Humans in Poker and Games of Strategic Negotiation.txt
Noam Brown,I think I used Visual Studio actually. Okay. Yeah.,Noam Brown - AI vs Humans in Poker and Games of Strategic Negotiation.txt
Lex Fridman,Is that still carried through today?,Noam Brown - AI vs Humans in Poker and Games of Strategic Negotiation.txt
Noam Brown,"vs. Code is what I use today, it",Noam Brown - AI vs Humans in Poker and Games of Strategic Negotiation.txt
Lex Fridman,"seems like it's pretty community basically converged on Okay, cool. So you got you got this super optimized C++ system? And then you show up to the deer competition? Yeah. Humans versus machine. How did it feel throughout the day,",Noam Brown - AI vs Humans in Poker and Games of Strategic Negotiation.txt
Noam Brown,"super stressful. I mean, I thought going into it that we had like a 5050 chance, because basically, I thought if if they play in a totally normal style, I think will squeak out a win. But there's always a chance that they can find some weakness in the bottom. And if they do, and we're playing, like, for 20 days, 120,000 hands of poker, they have a lot of time to find weaknesses in the system. And if they do, we're gonna get crushed. And that's actually what happened in the previous competition. The humans, you know, they started out, it wasn't like, they were winning from the start. But then they found these weaknesses that they could take advantage of. And for the next they know, like, 10 days, they were just just crushing the bots stealing money from it,",Noam Brown - AI vs Humans in Poker and Games of Strategic Negotiation.txt
Lex Fridman,"what were the weaknesses, the phone, like, maybe over betting was effective, that kind of stuff. So certain betting strategies worked.",Noam Brown - AI vs Humans in Poker and Games of Strategic Negotiation.txt
Noam Brown,"What they found is Yeah, over betting, like betting certain amounts, the bot would have a lot of trouble dealing with those sizes. And then also, when the bot got into really difficult all in situations, it wasn't able to because it wasn't doing search, it had to clump different hands together, and it wouldn't, it would treat them identically. And so it wouldn't be able to distinguish, you know, like, having a king high flush versus an ace high flush. And in some situations, that really matters a lot. And so they could put the bot into those situations, and then the bot would would just bleed money.",Noam Brown - AI vs Humans in Poker and Games of Strategic Negotiation.txt
Lex Fridman,"Clever humans. Okay, so I didn't realize it was over 20 days. So what were the humans like over those 20 days? And what was the bot like?",Noam Brown - AI vs Humans in Poker and Games of Strategic Negotiation.txt
Noam Brown,"So we had set up the competition, you know, like I said, there was $200,000 in prize money. And they would get paid a fraction of that, depending on how well they did relative to each other. Yeah, so I was kind of hoping that they wouldn't work together to try to find weaknesses in the bot. But they entered the competition with their like, number one objective being to beat the bot, and they didn't care about like individual glory, they were like, We're all gonna work as a team to try to take down this bot. And so they immediately started comparing notes, what they would do is they would coordinate looking at different parts of the strategy to try to try to you know, find out weaknesses. And then at the end of the day, we actually sent them a log of all the hands that were played and what cards the bot had on each of those hands.",Noam Brown - AI vs Humans in Poker and Games of Strategic Negotiation.txt
Lex Fridman,"Oh, yeah, that's good. See? Yeah,",Noam Brown - AI vs Humans in Poker and Games of Strategic Negotiation.txt
Noam Brown,"it was honestly I'm not sure why we did that in retrospect, but I mean, I'm glad we did because we ended up winning anyway. But that if you've ever played poker before, like that is golden information. I mean, no Usually when you play poker, you see about a third of the hands to showdown. And to just hand them all the cards that the bot had on every single hand. That was just just a goldmine for them. And so then they would review the hands and try to see like, Okay, could they find patterns in the bot weaknesses? And could they, then then they would coordinate and study together and try to figure out okay, now, this person is going to explore this part of the strategy for weaknesses, this person is gonna explore this part of the strategy for weaknesses.",Noam Brown - AI vs Humans in Poker and Games of Strategic Negotiation.txt
Lex Fridman,"It's a kind of psychological warfare, showing them the hands. Yeah. I mean, I'm sure you didn't think of it that way. But like doing that means you're confident in the bots abilities went?",Noam Brown - AI vs Humans in Poker and Games of Strategic Negotiation.txt
Noam Brown,"Well, that's, that's one way of putting it. I wasn't super confident. Yeah. So, you know, going into, like I said, I think I had like, 5050 odds on us winning the, when we actually when we announced the competition, the poker community decided to gamble on who would win. And their initial odds against us were like four to one, they, they were really convinced that the humans were going to pull out when the bot ended up winning for three days straight. And even then, after three days, the betting odds were still just 5050. And then at that point, it started to look like the humans were coming back. They started to like, you know, but but poker is a very high variance game. And I think what happened is like, they thought that they spotted some weaknesses that weren't actually there. And then around day eight, it was just very clear that they were getting absolutely crushed. And from that point, for, for a while there, I was super stressed out, thinking like, Oh, my God, the humans are coming back. And we're just they found weaknesses. And now we're just gonna lose the whole thing. But no, it ended up going in the other direction. And the bot ended up like crushing them in the long run.",Noam Brown - AI vs Humans in Poker and Games of Strategic Negotiation.txt
Lex Fridman,"How did it feel at the end, like, as a human being would, as a person who loves appreciates the beauty of the game of poker? And as the person who appreciates the beauty of AI? Is there? Did you feel a certain kind of way, but it",Noam Brown - AI vs Humans in Poker and Games of Strategic Negotiation.txt
Noam Brown,"felt a lot, a lot of things, man. I mean, at that point in my life, I had spent five years working on this project. And it was a huge sense of accomplishment. I mean, to spend five years working on something and finally see it succeed. Yeah, I wouldn't trade that for anything in the world.",Noam Brown - AI vs Humans in Poker and Games of Strategic Negotiation.txt
Lex Fridman,"Yeah, because it's, that's a real benchmark. It's not like getting some percent accuracy in a dataset. This is like real, this is real world. It's just a game. But it's also a game, that means a lot to a lot of people. And this is humans doing their best to beat the machine. So this is a real benchmark, unlike anything else.",Noam Brown - AI vs Humans in Poker and Games of Strategic Negotiation.txt
Noam Brown,"Yeah. And I mean, this is, this is what I had been dreaming about, since I was like 16, playing poker, you know, with my friends in high school, the idea that you could find a strategy, you know, approximate the Nash equilibrium, able to beat all the poker players in the world with it, you know, so to actually see that come to fruition and be realized. That was, it's kind of magical.",Noam Brown - AI vs Humans in Poker and Games of Strategic Negotiation.txt
Lex Fridman,"Yeah, especially money's on the line, too. It's a different it's different than chess. And that aspect, like people get, that's why you want to look at betting markets, if you want to actually understand what people really think in the same sense poker, it's really high stakes, because it's money. And to solve that game, that's, that's an amazing accomplishment. So the leap from that to multi way six player poker, what's, how difficult is that jump? And what are some interesting differences between heads up poker and, and multi-way Poker?",Noam Brown - AI vs Humans in Poker and Games of Strategic Negotiation.txt
