speaker,speech,document
Noam Brown,"I mean, there are a lot of ways that this could fail. So for example, I mean, you could have a situation where you're, you're basically like, we don't tell the the language model, like here are the pieces of our action or the other person's action that you should be communicating. And so like, let's say you're about to attack somebody, you probably don't want to tell them that you're going to attack them. But there's nothing in the language like the language model is not very smart at the end of the day. So it doesn't really have a way of knowing like, well, what should I be talking about? Should I tell this person that I'm about to attack them or not? So we have to, like develop a lot of other techniques that that deal with that. Like one of the things we do, for example, is we try to calculate, if I'm going to send this message, what would I expect the other person to do in response? So if it's a message like, Hey, I'm going to attack you this turn, they're probably going to, you know, attack us or defend against that attack. And so we have a way of recognizing like, hey, sending this message is a negative expected value action and we should not send this message.",Noam Brown - AI vs Humans in Poker and Games of Strategic Negotiation.txt
Lex Fridman,So you have for particular kinds of messages. You have like an extra function that does the have estimated the value of that message.,Noam Brown - AI vs Humans in Poker and Games of Strategic Negotiation.txt
Noam Brown,Yeah. So we have these kinds of filters that like to filter.,Noam Brown - AI vs Humans in Poker and Games of Strategic Negotiation.txt
Lex Fridman,So there's a good is that filter on your network? Or is it rule based?,Noam Brown - AI vs Humans in Poker and Games of Strategic Negotiation.txt
Noam Brown,"That's, that's a neural network. So we're, well, it's a it's a combination. It's a neural network, but it's also using planning. It's trying to compute like, what is the policy that the other players are going to play given that this message has been sent? And then is that better than not sending the message or, or feel like",Noam Brown - AI vs Humans in Poker and Games of Strategic Negotiation.txt
Lex Fridman,"that's how my brain works to like, there's a language model that generates random crap. And then there's these other neural nets that are essentially filters. At least that's when I tweet. I'll usually my process of tweeting, I'll think of something. And it's hilarious to me. And then about five seconds later, the filter network comes in and says, no, no, it's not funny at all. That me there's some something interesting to that kind of process. So you have a set of actions that you you want, you have an intent, the you want to achieve an intent that you want your opponent to achieve the generate messages, and then you evaluate those messages will achieve the the goal you want.",Noam Brown - AI vs Humans in Poker and Games of Strategic Negotiation.txt
Noam Brown,"Yeah, we're filtering for several things. We're filtering, like, is this a sensible message, you know, so sometimes language models will send will generate messages that are just like, totally nonsense. And we try to filter those out, we also try to filter out messages that that are basically lies. So, you know, diplomacy has this reputation as a game that's really about deception and lying. But we try to actually minimize the amount that the bot would lie. This was actually mostly or are",Noam Brown - AI vs Humans in Poker and Games of Strategic Negotiation.txt
Lex Fridman,you scared?,Noam Brown - AI vs Humans in Poker and Games of Strategic Negotiation.txt
Noam Brown,"I mean, like, part of the reason for this is that we actually found that lying, would make the bot perform worse, in the long run, it would end up with a lower score. Because once the bot lies, people will never trust it again. And trust is a huge aspect of the game of diplomacy notes",Noam Brown - AI vs Humans in Poker and Games of Strategic Negotiation.txt
Lex Fridman,"here, because I think this is applies to, to life lessons two,",Noam Brown - AI vs Humans in Poker and Games of Strategic Negotiation.txt
Noam Brown,"oh, I think it's a really yeah, really strong. So",Noam Brown - AI vs Humans in Poker and Games of Strategic Negotiation.txt
Lex Fridman,"like lying is a dangerous thing to do. Like, you want to avoid obvious lying.",Noam Brown - AI vs Humans in Poker and Games of Strategic Negotiation.txt
Noam Brown,"Yeah, I mean, I think when people play diplomacy for the first time, they approach it as a game of deception and lying. And, and they ultimately, if you talk to top diplomacy players, what they'll tell you is that diplomacy is a game about trust, and being able to build trust in an environment that encourages people to not trust anyone. So that's the ultimate tension in diplomacy. How can this AI reason about whether you are being honest in your communication? And how can the AI persuade you that it is being honest, when it is telling you that, hey, I'm actually going to support you this turn?",Noam Brown - AI vs Humans in Poker and Games of Strategic Negotiation.txt
Lex Fridman,"Is there some sense I don't know if you step back and think that this process will indirectly help us study human psychology? So like, if trust is the ultimate goal, would not help us understand what are the fundamental aspects of forming trust between humans and between humans and AI? I mean, that's a really, really important question that's much bigger than the strategy games is how can this fundamental to the human robot interaction problem? How do we form trust between intelligent entities?",Noam Brown - AI vs Humans in Poker and Games of Strategic Negotiation.txt
Noam Brown,"So one of the things I'm really excited about with diplomacy, there's never really been a good domain to investigate these kinds of questions. And diplomacy gives us a domain where trust is really at the center of it. And it's not just like you've hired a bunch of mechanical Turkers that, you know, are being paid and trying to get through the task as quickly as possible. You have these people that are really invested in the outcome of the game, and they're really trying to do the best that they can. And so I'm really excited that we're able to, we actually, like have put together this, we're open sourcing all of our models, we're open sourcing, all of the all the code, and we're making the data that we've used available to researchers, so that they can investigate these kinds of questions.",Noam Brown - AI vs Humans in Poker and Games of Strategic Negotiation.txt
Lex Fridman,"So the data of the different the human in the eye, AI play of diplomacy, and the models that you use for the generation of the messages and the filtering.",Noam Brown - AI vs Humans in Poker and Games of Strategic Negotiation.txt
Noam Brown,"Yeah, not not just even the data of the AI playing with the humans, but all the training data that we that we had, that we use to train the AI to understand how humans play the game. We're setting up a system where researchers will be able to apply to be able to gain access to that data and be able to to use it in their own research, which is to say, what is",Noam Brown - AI vs Humans in Poker and Games of Strategic Negotiation.txt
Lex Fridman,"the name of the system? We're calling the bot Cicero, Cicero. And what's the name like that? You're open sourcing? What's the name of the repository and, and the like the project? Is it also just called sister with a big project? Are you still coming up with a name?",Noam Brown - AI vs Humans in Poker and Games of Strategic Negotiation.txt
Noam Brown,"The data set comes from this website, web diplomacy.net Is the site that's been online for like 20 years now and it's been One of the main sites that people use to play diplomacy on it, we've got like 50,000 games of diplomacy with natural language communication, over 10 million messages. So it's a pretty massive data set that people can use to. We're hoping that the academic community, the research community, is able to use it for all sorts of interesting research questions.",Noam Brown - AI vs Humans in Poker and Games of Strategic Negotiation.txt
Lex Fridman,So to you from having studied this game is a sufficiently rich problem space to explore this kind of human AI interaction.,Noam Brown - AI vs Humans in Poker and Games of Strategic Negotiation.txt
Noam Brown,"Yeah, absolutely. And I think it's, I think it's maybe the best data set that I can think of out there to to investigate these kinds of questions of negotiation, trust, persuasion, I wouldn't say it's the best data set in the world for human AI interaction. That's a very broad field. But I think that it's definitely up there as like, you know, if you're really interested in language models interacting with humans in, you know, a setting where their incentives are not fully aligned. This seems like an ideal data set for investigating that. So",Noam Brown - AI vs Humans in Poker and Games of Strategic Negotiation.txt
Lex Fridman,"you have you have a paper with some impressive results, and just an impressive paper that taking this problem on what's the most exciting thing to you in terms of the results from the paper? Well, I think there's ideas or results.",Noam Brown - AI vs Humans in Poker and Games of Strategic Negotiation.txt
Noam Brown,"Yeah, I think there's a few aspects of the results, and that I think, are really exciting. So first of all, the fact that we were able to achieve such strong performance, I was surprised by and pleasantly surprised by. So we played 40 games of diplomacy with real humans, and the bot placed second, out of all players that have played five or more games. So it's about 80 players total 19, of whom played five or more games, and the bot was ranked second out of those players. And the bot was was really good in two dimensions, one, being able to establish strong connections with the other players on the board, being able to, like, persuade them to work with it, being able to coordinate with them about like, how it's going to work with them. And then also the raw, tactical and strategic aspects of the game, you know, being able to understand what the other players are likely to do being able to model their behavior and respond appropriately to that. The bot also really excelled at,",Noam Brown - AI vs Humans in Poker and Games of Strategic Negotiation.txt
Lex Fridman,"what are some interesting things that the bot said, By the way, you're lots of swear in the car, there are rules to what you're allowed to say and not in diplomacy.",Noam Brown - AI vs Humans in Poker and Games of Strategic Negotiation.txt
Noam Brown,"You can say whatever you want, I think the site will get very angry at you if you start like threatening somebody. And if we act,",Noam Brown - AI vs Humans in Poker and Games of Strategic Negotiation.txt
Lex Fridman,"like if you threaten somebody, you're supposed to do it politely, yeah, politely,",Noam Brown - AI vs Humans in Poker and Games of Strategic Negotiation.txt
Noam Brown,"you know, like keep it in character. That we actually had a researcher watching the bot 24/7 for a while, whenever we play a game, we had a bot watching it to make sure that it wouldn't go off the rails and start like threatening somebody or something like that. I would",Noam Brown - AI vs Humans in Poker and Games of Strategic Negotiation.txt
Lex Fridman,"just love it if the bots started like mocking, mocking everybody, like some weird quirky strategies would emerge that have you seen anything interesting that you ha, that's a weird, that's a that's a weed behavior, either the filter or the language model? That was weird to you.",Noam Brown - AI vs Humans in Poker and Games of Strategic Negotiation.txt
Noam Brown,"That was yeah, there were definitely like, things that the bot would, would do that were not in line with, like how humans would approach the game. And that in a good way, the humans actually, you know, we've talked to some expert diplomacy players about these results. And their takeaway is that, well, maybe humans are approaching this the wrong way. And this is actually like the right way to play the game.",Noam Brown - AI vs Humans in Poker and Games of Strategic Negotiation.txt
Lex Fridman,"So what's required to win? Like, what? What does it mean to mess up or to exploit the suboptimal behavior of a player? Like, is there? Is there optimally rational behavior and irrational behavior the to estimate that kind of stuff? Like what, what stands out to you? Like, is there a crack that you can exploit? Is there like, a weakness that you can exploit in the game that everybody's looking for?",Noam Brown - AI vs Humans in Poker and Games of Strategic Negotiation.txt
Noam Brown,"Well, I think you're asking kind of two questions there. So one, like modeling the irrationality and the sub optimality of humans, you can't in diplomacy, you can't treat all the other players like their machines. And if you do that, you're you're going to end up playing really poorly. And so we actually ran this experiment. So we, we trained a bot, in a two player zero sum version of diplomacy, the same way that you might approach a game like chess or poker, and the bot was superhuman, it would crush any competitor. And then we took that same training approach. And we trained a bot for the full seven player game version of the game through self play, without any human data. And we stuck it in a game with six humans, and it got destroyed. Even in the version of the game where there's no explicit natural language communication. It still got destroyed, because it just wouldn't be able to understand how the other players were approaching the game and be able to work with that.",Noam Brown - AI vs Humans in Poker and Games of Strategic Negotiation.txt
Lex Fridman,"Can you can you just linger on that meaning like there's an individual, there's an individual personality Each player and then you're supposed to remember that, but what do you mean, it's not able to understand the players?",Noam Brown - AI vs Humans in Poker and Games of Strategic Negotiation.txt
Noam Brown,"Well, it would, for example, expect the human to support it in a certain way, when the human would simply like, Thank you like, No, I'm not supposed to support you here. It's kind of like, you know, if you develop a self driving car, and it's trained completely from scratch with other self driving cars, it might learn to drive on the left side of the road. And that's a totally reasonable thing to do if you're with these other self driving cars that are also driving on the left side of the road. But if you put it in an American city, it's going to crash.",Noam Brown - AI vs Humans in Poker and Games of Strategic Negotiation.txt
Lex Fridman,"But I guess the intuition I'm trying to build up was, what is it then crush a human player heads up. This is multiple,",Noam Brown - AI vs Humans in Poker and Games of Strategic Negotiation.txt
Noam Brown,"this is an aspect of two players Euro song versus games that involve cooperation. So in a two player zero sum game, you can do self play from scratch, and you will arrive at the Nash equilibrium, where you don't have to worry about the other player playing in a very human suboptimal style, that's just going to be the only way that deviating from a Nash equilibrium would would change things is if it helped you.",Noam Brown - AI vs Humans in Poker and Games of Strategic Negotiation.txt
Lex Fridman,"So what's the dynamic of cooperation that's effective? And diplomacy? Do you always have to have one friend in the game,",Noam Brown - AI vs Humans in Poker and Games of Strategic Negotiation.txt
Noam Brown,you always want to maximize your friends and minimize your enemies?,Noam Brown - AI vs Humans in Poker and Games of Strategic Negotiation.txt
Lex Fridman,"Got it, and boy, in the line comes into play there. So the more friends you have the better?",Noam Brown - AI vs Humans in Poker and Games of Strategic Negotiation.txt
Noam Brown,"Yeah, I mean, I guess you have to attack somebody else, you're not going to make progress. Right? So that's",Noam Brown - AI vs Humans in Poker and Games of Strategic Negotiation.txt
Lex Fridman,"the tension. But we have this is too real. This is too real, too. This is too too close to God, geopolitics of actual military conflict in the world. Okay. That's fast. And so that cooperation element is what makes the game really, really hard.",Noam Brown - AI vs Humans in Poker and Games of Strategic Negotiation.txt
Noam Brown,"Yep. And to give you an, like, an example of how this sub optimality and irrationality comes into play, there's a really common situation in the game of diplomacy, that where one player starts to win, and they're like, at the point where they're controlling about half the map, yeah, and the remaining players who have all been fighting each other, the whole game, all have to, like work together now to stop this other player from winning, or else everybody's gonna lose. And it's kind of like, you know, Game of Thrones, like, really seen the show, like, you know, he got the the others coming from the north, and like, all the people have to start work out the differences and stop them from from taking over. And the bot will do this, the bot will work with the other players to stop the superpower from winning. But if it doesn't really, if it's trained from scratch, or it doesn't really have a good grounding in how humans approach it, it will also at the same time, attack the other players with its extra units. So all the units that are not necessary to stop the superpower from winning, it will use those to grab as many centers as possible from the other players. And in totally rational play, the other players should just live with that, you know, they have to understand like, hey, a score of one is better than a score of zero. So, so, okay, he's grabbed my centers, but I'll just deal with it. But humans don't act that way. Right? The human gets really angry at the bot and ends up throwing the game. Because, you know, I'm going to screw you over because you did something that's not fair to me.",Noam Brown - AI vs Humans in Poker and Games of Strategic Negotiation.txt
Lex Fridman,"Got it? And I suppose the model that is the Boss Boss model, that kind of human frustration? Yeah,",Noam Brown - AI vs Humans in Poker and Games of Strategic Negotiation.txt
Noam Brown,"exactly. And so that is something that seems almost impossible to model purely from scratch without any human data. It's a very cultural thing. Yeah. And so you need human data, to be able to understand that, hey, that's how humans behave. And you have to work around that it might be suboptimal and might be rational. But, but that's an aspect of humanity that you have to you have to deal with.",Noam Brown - AI vs Humans in Poker and Games of Strategic Negotiation.txt
Lex Fridman,"So how difficult is it to train on human data given that human data is very limited, versus what the US a purely self play mechanism can generate?",Noam Brown - AI vs Humans in Poker and Games of Strategic Negotiation.txt
Noam Brown,"That's actually one of the major challenges that we faced in the research that we had a good amount of human data, we had about 50,000 games, what we try to do is leverage as much self play as possible, while still leveraging the human data. So what we do is we do self play, very similar to how it's been done in poker and go, but we try to regularize the self play towards the human data. Basically, the way to think about it is we penalize the bot for choosing actions that are very unlikely under how under the human data set. And so, you",Noam Brown - AI vs Humans in Poker and Games of Strategic Negotiation.txt
Lex Fridman,"know, is there some kind of function that says, This is human like and not?",Noam Brown - AI vs Humans in Poker and Games of Strategic Negotiation.txt
Noam Brown,"Yeah, so we we train a bot through supervised learning to model the human play as much as possible. So we basically like train a neural net on those 50,000 games. And that gives us an approximate that gives us a policy that resembles to some extent how humans actually play the game. Now, this isn't a perfect model of human play. Because we don't have unlimited data. We don't have unlimited neural net that capacity, but it gives us some approximation.",Noam Brown - AI vs Humans in Poker and Games of Strategic Negotiation.txt
Lex Fridman,"Is there some data on the internet that's useful besides just diplomacy? So on the language side of things, is there some can you go to like Reddit? And so sort of background model formulation that that's useful for the game of diplomacy?",Noam Brown - AI vs Humans in Poker and Games of Strategic Negotiation.txt
Noam Brown,"Yeah, absolutely. And so for the language model, which is kind of like a separate question, you know, we didn't use the language model during self play training. But we pre trained the language model on, you know, tons of internet data as much as possible. And then we fine tuned it specifically on to diplomacy games. So we are able to, like leverage the wider data set in order to fill in some of the gaps and like how communication happens more broadly, besides just like, specifically in these diplomacy games.",Noam Brown - AI vs Humans in Poker and Games of Strategic Negotiation.txt
Lex Fridman,"Okay, cool. So what some, what are some interesting things that came to life from this from this work? To you like, what, what are some insights about, about games, where natural language is involved in cooperation, deep cooperation is involved?",Noam Brown - AI vs Humans in Poker and Games of Strategic Negotiation.txt
Noam Brown,"Well, I think there's a few insights. So first of all, the fact that you can't rely purely or even largely on soft play that you really have to have an understanding of how humans approach the game. I think that that's one of the major conclusions that I'm drawing from this work. And that is, I think, applicable more broadly to a lot of different games. So we've actually already taken the approaches that we've used in diplomacy and try them on a cooperative card game called Hanabi. And we've had a lot of success in that game as well. On the language side, I think the fact that we were able to control the language model, through this intense approach was very effective. And it allowed us, instead of just imitating how humans would communicate, we're able to go beyond that and able to feed into it superhuman strategies, that it can then, you know, generate messages corresponding to,",Noam Brown - AI vs Humans in Poker and Games of Strategic Negotiation.txt
Lex Fridman,is there something you can say about detecting whether a person or AI is lying or not?,Noam Brown - AI vs Humans in Poker and Games of Strategic Negotiation.txt
Noam Brown,"The bot doesn't explicitly try to calculate whether somebody is lying or not. But what it will do is try to predict what actions they're going to take, given the communications, given the messages that they've sent to us. So given our conversation, what do I think you're going to do? And implicitly, there is a calculation about whether you're lying to me in that, you know, if, if you're based on your messages, if I think you're going to attack me this turn, even though your messages say that you're not, then, you know, essentially, the bot is predicting that you're lying. But it doesn't view it as as lying the same way that we would view it as lying.",Noam Brown - AI vs Humans in Poker and Games of Strategic Negotiation.txt
Lex Fridman,But you could probably reformulate with all the same data and make a classifier lying or not.,Noam Brown - AI vs Humans in Poker and Games of Strategic Negotiation.txt
Noam Brown,"Yeah, I think I think you could do that. That was not something that we were focused on. But I think that it is possible that, you know, if you came up with some measurements of like, what does it mean to tell a lie? Because there's a spectrum, right? Like, if you're withholding some information, is that a lie? If you mostly telling the truth, but you forgot to mention this, like one action out of like, 10? Is that a lie? It's hard to draw the line. But you know, if you're willing to do that, and then you could possibly use it to do",Noam Brown - AI vs Humans in Poker and Games of Strategic Negotiation.txt
Lex Fridman,"this feels like an argument inside a relationship. Now, what constitutes a lie? Depends what you mean by the definition of the word is, okay. Still, it's fascinating, because trust and lying is all intermixed into this. And it's language models that are becoming more and more sophisticated. It's just a fascinating space to explore. What what do you see as the future of this work? That is inspired by the breakthrough performance that you're getting here with diplomacy?",Noam Brown - AI vs Humans in Poker and Games of Strategic Negotiation.txt
Noam Brown,"I think there's a few different directions to take this work. I think really, what it's showing us is the potential that language models have. I mean, I think a lot of people didn't think that this kind of result was possible even today, despite all the progress that's been made in language models. And so it shows us how we can leverage the power of things like self play on top of language models to get increasingly better performance. And the ceiling is really much higher than what we have right now.",Noam Brown - AI vs Humans in Poker and Games of Strategic Negotiation.txt
